name_article,prmotion,price,precentage_promotion,rank
Spirit Of Gamer Clavier Gamer pro  - Pro k5 - Noir,54.00 TND,80.00 TND,33%,None
Spirit Of Gamer Clavier Gamer - Pro k5 - Noir,54.00 TND,75.00 TND,28%,4.4 out of 5
Spirit Of Gamer Tapis de souris XXL -10 MODE RGB - 80*30*0.4 cm,108.00 TND,135.00 TND,20%,None
Spirit Of Gamer Tapis de souris XXL - 30*78 - Bleu/Noir,65.00 TND,85.00 TND,24%,4 out of 5
Spirit Of Gamer Tapis de souris gaming RGB - Noir,79.00 TND,None,None,None
Spirit Of Gamer Clavier Gaming Slim Rgb Metal PRO-K7 - Noir,63.00 TND,108.00 TND,42%,4 out of 5
Spirit Of Gamer Clavier RGB - Semi mécanique,69.00 TND,95.00 TND,27%,5 out of 5
Spirit Of Gamer Tapis XL - Drakkar - RGB - 800*300mm,104.00 TND,125.00 TND,17%,None
Spirit Of Gamer Clavier Gamer - Pro k8 - Noir,67.00 TND,85.00 TND,21%,None
Spirit Of Gamer Tapis de souris M -10 MODE RGB - 30*23*0.4 cm,69.00 TND,75.00 TND,8%,5 out of 5
Spirit Of Gamer Clavier + Souris Elite Pack Mk30 - Noir,98.00 TND,164.00 TND,40%,None
Spirit Of Gamer Souris Gaming Pro M6 - Noir,46.00 TND,65.00 TND,29%,None
Spirit Of Gamer Clavier gaming PRO K5 - spirit of gamer,55.00 TND,None,None,5 out of 5
Spirit Of Gamer Clavier Gaming - Pro K8 - Noir,58.00 TND,98.00 TND,41%,5 out of 5
Spirit Of Gamer Clavier+Souris+Tapis Pmk3 - Noir,77.00 TND,120.00 TND,36%,1 out of 5
Havit Tapis  Souris - Gamer MS 860,26.00 TND,40.00 TND,35%,4.4 out of 5
Xtrike Pack Gamer 4 En 1 clavier Souris Casque et Tapie de souris,58.50 TND,99.00 TND,41%,3.8 out of 5
R8 Pack - Clavier Souris Gaming  -1909 -  Avec Tapis Gamer,38.00 TND,79.00 TND,52%,3.7 out of 5
Jedel Pack - Clavier Souris Gaming   -  Avec Tapis Gamer,29.00 TND,50.00 TND,42%,2.7 out of 5
Logilily Tapis souris gamer - Noir/Rouge,10.00 TND,25.00 TND,60%,4.2 out of 5
Tapis gamer - Wild Wolf - 300 x 250 mm - Gris,5.80 TND,15.00 TND,61%,4.2 out of 5
Tapis gamer - XXL 700 x 300 - Noir,11.90 TND,29.00 TND,59%,4.3 out of 5
Jedel Souris Gamer -M80 -Noir,12.00 TND,19.00 TND,37%,4 out of 5
white shark Tapis de souris Gamer GMP-2101 BLACK KNIGHT,27.90 TND,35.00 TND,20%,None
Souris gamer USB Led 5500 DPI Optique,20.00 TND,35.00 TND,43%,3.9 out of 5
white shark Tapis de souris Gamer Minotaur MP-1964 - Noir,12.20 TND,15.00 TND,19%,4.3 out of 5
Tapis gamer V4 - XXL 700 x 300 - Noir - PLAYER UNKNOWN,11.00 TND,29.00 TND,62%,4 out of 5
T-DAGGER Clavier gamer -Tanker,35.00 TND,45.00 TND,22%,None
R8 Souris Gamer R8 1614 Usb Rétro-Éclairé Led 2400dpi 5 Boutons,16.00 TND,25.00 TND,36%,None
Fantech Tapis De Souris - Gamer - MP80 - Noir - Rouge,35.00 TND,55.00 TND,36%,4.6 out of 5
Advance Clavier Gamer - Gta 230 - Semi mécanique - Noir,45.00 TND,65.00 TND,31%,4.5 out of 5
Cesar Souris  et Tapis Gamer  - G500,27.00 TND,30.00 TND,10%,4.5 out of 5
Souris Avec Tapis Gamer - MX7D - Noir,38.00 TND,59.00 TND,36%,None
Advance Souris Gamer RGB GTA 210  - Led rainbow -7 Boutons,27.00 TND,35.00 TND,23%,4.6 out of 5
Logilily Tapis de Souris gamer - Motif dragon - Noir/Vert,10.00 TND,25.00 TND,60%,4.1 out of 5
Un Tapis gamer - XXL 700 x 300 - Noir,21.00 TND,30.00 TND,30%,4.3 out of 5
Redragon Tapis souris gamer,25.00 TND,35.00 TND,29%,None
Pack souris pptique Gamer SOG-R + Tapis souris gaming mouse Pad LKSM-X88 Gris,19.90 TND,25.00 TND,20%,None
white shark Tapis de souris Gamer LED (MP-1862),59.00 TND,69.00 TND,14%,4.7 out of 5
Redragon Gamer Souris  - M711 Cobra - RGB,69.00 TND,89.00 TND,22%,None
